Dialogue ID,Character Name,Dialogue,Topic
2039,Hermione Granger,"No one was screaming, Harry.",social dynamics
539,Hermione Granger,I know a spell when I see one... Snape wasn't blinking.,magic
397,Hermione Granger,Filch is gone.,hogwarts academics
3273,Hermione Granger,"Sir, the second task is only hours away.",strategy
713,Hermione Granger,What is it?,strategy
2215,Hermione Granger,How are you feeling?,social dynamics
795,Hermione Granger,"What's wrong, Harry?",social dynamics
1323,Hermione Granger,Are you okay?,social dynamics
2722,Hermione Granger,We have to go.,strategy
2696,Hermione Granger,That's great.,social dynamics
600,Hermione Granger,Look at you playing with your cards. Pathetic! Exams are coming.,hogwarts academics
2616,Hermione Granger,This is a Time Turner Harry.,magic
706,Hermione Granger,I've always heard Hogwarts exams were frightful...,hogwarts academics
2432,Hermione Granger,That felt good.,social dynamics
2691,Hermione Granger,A Patronus requires a powerful wizard.,magic
1245,Hermione Granger,The Chamber of Secrets has been opened... written in blood.,threats
353,Hermione Granger,"Harry, no way! ... You don't even know how to fly. What an idiot.",social dynamics
2357,Hermione Granger,Ronald has lost his rat.,magical creatures
785,Hermione Granger,What is that?,strategy
2919,Hermione Granger,It's not going to work.,strategy
2565,Hermione Granger,That looks really painful.,social dynamics
2072,Hermione Granger,Divination is woolly; Ancient Runes is fascinating.,hogwarts academics
473,Hermione Granger,Ron's right Harry. You're gonna need your strength today.,strategy
1289,Hermione Granger,McGonagall is worried. All the teachers are.,social dynamics
606,Hermione Granger,We're to be given quills with anti-cheating spells.,hogwarts academics
1988,Hermione Granger,"Good morning, Mr. Weasley.",social dynamics
744,Hermione Granger,Ow! You stood on my foot!,social dynamics
458,Hermione Granger,Is it...dead?,threats
3122,Hermione Granger,I can't believe it—she's done it again...,social dynamics
2104,Hermione Granger,Hagrid! He needs the hospital!,strategy
2636,Hermione Granger,Fudge is coming. Why aren't we leaving?,strategy
513,Hermione Granger,It's Snape! He's jinxing the broom!,threats
3020,Hermione Granger,Dean was told by Parvati... Hagrid's looking for you.,magical creatures
1291,Hermione Granger,The Heir of Slytherin has returned... who is it?,strategy
1052,Hermione Granger,Come on! Everyone's been worried.,social dynamics
709,Hermione Granger,It's happened before.,strategy
245,Hermione Granger,"Oh, no. Okay, relax.",social dynamics
627,Hermione Granger,"Honestly, don't you two read? Philosopher's Stone is a legendary substance...",strategy
2618,Hermione Granger,Dumbledore wanted us to return.,strategy
2016,Hermione Granger,Seems to be. Why?,strategy
2858,Hermione Granger,Sirius will want to hear about this.,strategy
2486,Hermione Granger,We're in the Shrieking Shack.,strategy
2117,Hermione Granger,Dufftown? That's not far.,strategy
1176,Hermione Granger,Get off me!,social dynamics
228,Hermione Granger,Pleasure. You two better change into your robes... You've got dirt on your nose.,hogwarts academics
2911,Hermione Granger,There's a reason those curses are unforgivable.,threats
801,Hermione Granger,I don't like this. Not at all.,social dynamics
805,Hermione Granger,Now what do we do?,strategy
629,Hermione Granger,It means you'll never die.,threats
2761,Hermione Granger,Are you all right?,social dynamics
787,Hermione Granger,Curious. I've never seen birds like these.,magical creatures
2586,Hermione Granger,Professor Lupin?,hogwarts academics
1381,Hermione Granger,She's a little sensitive.,social dynamics
817,Hermione Granger,"No Ron, you can't! There must be another way!",strategy
1197,Hermione Granger,At least no one on the Gryffindor team had to buy their way in.,hogwarts academics
2482,Hermione Granger,Oh I'm sorry.,social dynamics
792,Hermione Granger,There must be 1000 keys up there!,strategy
824,Hermione Granger,Books and cleverness? There are more important things.,mentoring
399,Hermione Granger,It was locked.,strategy
765,Hermione Granger,Do what I say. Trust me.,strategy
2727,Hermione Granger,What's he talking about Harry?,strategy
317,Hermione Granger,"I've read about those. When the smoke turns red, it means you've forgotten something.",magic
1299,Hermione Granger,The Polyjuice Potion allows transformation.,magic
1307,Hermione Granger,I know. But it's the only plan we've got.,strategy
3269,Hermione Granger,Again obvious—potentially problematic.,strategy
3243,Hermione Granger,These tasks are brutal... I'm scared for you.,threats
3229,Hermione Granger,That's what you think?,social dynamics
1293,Hermione Granger,If you're talking about Malfoy.,social dynamics
3091,Hermione Granger,Sorry I'll just go.,social dynamics
732,Hermione Granger,Now what do we do?,strategy
2366,Hermione Granger,How did it go Hagrid? The hearing?,strategy
3162,Hermione Granger,I won't be going alone—someone asked me.,social dynamics
1452,Hermione Granger,We must make sure Crabbe and Goyle can't interrupt.,strategy
1515,Hermione Granger,It was cat hair. Look at my face!,magic
403,Hermione Granger,"You don't use your eyes, do you? Didn't you see what it was standing on?",strategy
465,Hermione Granger,I went looking for the troll... I'd probably be dead.,threats
2412,Hermione Granger,Do you mind me trying? The Grim possibly.,magical creatures
3245,Hermione Granger,These tasks test you brutally... I'm scared.,threats
2484,Hermione Granger,Where does this go?,strategy
1481,Hermione Granger,Just go! You're wasting time!,strategy
2013,Hermione Granger,It's on his suitcase Ronald.,strategy
2603,Hermione Granger,We know the truth. Please believe us.,social dynamics
3017,Hermione Granger,Ronald would like me to tell you...,strategy
2126,Hermione Granger,Boggarts are shape-shifters.,magical creatures
2713,Hermione Granger,I don't like flying!,social dynamics
2567,Hermione Granger,Madam Pomfrey will fix it.,hogwarts academics
2890,Hermione Granger,Because they are unforgivable...,threats
407,Hermione Granger,"If you two don't mind... killed or worse, expelled!",hogwarts academics
3308,Hermione Granger,Are you alright? You must be freezing!,social dynamics
807,Hermione Granger,What happens now?,strategy
2612,Hermione Granger,You foul loathsome evil little cockroach!,social dynamics
405,Hermione Granger,It was standing on a trap door... guarding something.,strategy
2837,Hermione Granger,Harry it's his mark.,threats
1271,Hermione Granger,You hear a voice... then Mrs. Norris ends up Petrified.,strategy
2923,Hermione Granger,Dumbledore couldn't be fooled by an age potion.,strategy
1319,Hermione Granger,Let's go.,strategy
515,Hermione Granger,Leave it to me.,strategy
7432,Hermione Granger,Don't forget to give Professor Longbottom our best.,social dynamics
2009,Hermione Granger,Everywhere else is full.,strategy
2203,Hermione Granger,An Animagus elects to transform...,magic
2045,Hermione Granger,Just forget it.,social dynamics
1964,Hermione Granger,The Egyptians used to worship cats.,magical creatures
3160,Hermione Granger,Well spotted.,strategy
2086,Hermione Granger,Just ignore him.,social dynamics
730,Hermione Granger,Uh... we were just...,social dynamics
1295,Hermione Granger,"But Malfoy, the Heir of Slytherin?",strategy
1859,Hermione Granger,"Thanks, Sir Nicholas!",social dynamics
282,Hermione Granger,Nearly headless? How can you be nearly headless?,magical creatures
2705,Hermione Granger,This is horrible.,social dynamics
2645,Hermione Granger,Go Harry! Go!,strategy
375,Hermione Granger,You won't make a fool of yourself. It's in your blood.,social dynamics
2062,Hermione Granger,I've been here all this time.,strategy
1269,Hermione Granger,"It's a bit strange, isn't it?",social dynamics
815,Hermione Granger,What is it?,strategy
2921,Hermione Granger,This is an age line. Dumbledore drew it.,magic
2653,Hermione Granger,Come on Buckbeak—dead ferret!,magical creatures
2209,Hermione Granger,Go Harry! Go Harry!,social dynamics
2279,Hermione Granger,Want to move closer?,strategy
2649,Hermione Granger,Buckbeak—come quickly!,magical creatures
2425,Hermione Granger,They're going to kill Buckbeak.,threats
1147,Hermione Granger,Mandrake... Petrified... fatal cry.,threats
774,Hermione Granger,We've got to do something!,strategy
3310,Hermione Granger,Next to last.,strategy
1213,Hermione Granger,He called me a Mudblood.,threats
7423,Hermione Granger,Why didn't it work for him? The Elder wand.,strategy
1216,Hermione Granger,Mudblood means dirty blood... someone like me.,threats
2428,Hermione Granger,You foul loathsome evil little cockroach!,social dynamics
771,Hermione Granger,"He's not relaxing, is he?",social dynamics
463,Hermione Granger,"It's my fault, Professor McGonagall.",hogwarts academics
553,Hermione Granger,"Good, you can help Harry... Nicholas Flamel.",strategy
1579,Hermione Granger,It had to be a Gryffindor... unless it wasn't a student.,strategy
1372,Hermione Granger,We’ll have to wait for the Polyjuice Potion.,strategy
768,Hermione Granger,Are you okay?,social dynamics
3265,Hermione Granger,Harry tell me again.,strategy
2936,Hermione Granger,Go on Harry. For goodness sake.,strategy
2608,Hermione Granger,7:30—where were we?,strategy
1385,Hermione Granger,Do you think he's all right?,social dynamics
1862,Hermione Granger,Congrats! You solved it!,strategy
7422,Hermione Granger,Something my mum used to say.,social dynamics
877,Hermione Granger,"Come on, Harry.",strategy
6989,Hermione Granger,"How bad is it, Neville? With Snape as Headmaster.",hogwarts academics
3237,Hermione Granger,Ron you spoil everything!,social dynamics
3182,Hermione Granger,She said yes??,social dynamics
3489,Hermione Granger,Everything's going to change now isn't it?,social dynamics
2765,Hermione Granger,Wake up Ronald!,social dynamics
2124,Hermione Granger,No one knows.,strategy
2221,Hermione Granger,No one blames you Harry. Dumbledore is furious.,social dynamics
2693,Hermione Granger,Your dad's dead—I know—just telling you what I saw.,threats
1418,Hermione Granger,Slytherin was a Parselmouth... snakes.,magic
555,Hermione Granger,Not in the restricted section. Happy Christmas.,hogwarts academics
382,Hermione Granger,"The staircases change, remember?",strategy
2629,Hermione Granger,Fudge has to see Buckbeak.,strategy
2361,Hermione Granger,Take better care of your pets!,magical creatures
1298,Hermione Granger,We’d break fifty school rules... very dangerous.,hogwarts academics
2199,Hermione Granger,We just learned about red caps and hinkypunks.,hogwarts academics
3016,Hermione Granger,We've been through enough—just do it yourself.,social dynamics
2596,Hermione Granger,They've captured Sirius!,threats
1316,Hermione Granger,No! With a proper wand it's too risky!,magic
2703,Hermione Granger,That was so scary.,social dynamics
2041,Hermione Granger,That's why he gave you chocolate.,social dynamics
2687,Hermione Granger,At least someone's enjoying himself.,social dynamics
2661,Hermione Granger,Come on Buckbeak!,magical creatures
2006,Hermione Granger,"Honestly Ron, it's not funny.",social dynamics
2682,Hermione Granger,Look—it's Lupin.,social dynamics
226,Hermione Granger,Are you sure that's a real spell? ... Oculus Reparo. ... you're Harry Potter.,magic
1303,Hermione Granger,It's tricky. I've never seen a more complicated potion.,magic
2443,Hermione Granger,I meant me!,social dynamics
2641,Hermione Granger,Is that really what my hair looks like?,social dynamics
2680,Hermione Granger,We save Sirius.,strategy
1337,Hermione Granger,"You will be able to, won't you?",strategy
2854,Hermione Granger,How can the Ministry not know who conjured it?,strategy
3231,Hermione Granger,You know the solution then.,strategy
1410,Hermione Granger,You can talk to snakes.,magic
789,Hermione Granger,What's this all about?,strategy
3022,Hermione Granger,I'm NOT an owl!,social dynamics
6955,Hermione Granger,Do you hear much from the others? From the Order?,strategy
822,Hermione Granger,You'll be okay Harry. You're a great wizard.,social dynamics
3131,Hermione Granger,They're not for Ginny—they're for you!,social dynamics
1286,Hermione Granger,What does legend say lies within the Chamber?,strategy
3084,Hermione Granger,How are you feeling? Concentrate...,magic
2620,Hermione Granger,Thanks. Malfoy's coming.,social dynamics
1454,Hermione Granger,Sleeping Draught... once they're asleep...,magic
2277,Hermione Granger,Most haunted building in Britain.,magical creatures
624,Hermione Granger,Of course! Here it is! Nicholas Flamel...,strategy
758,Hermione Granger,Stop moving! This is Devil's Snare...,threats
3103,Hermione Granger,Your wand Harry! Your wand!,magic
871,Hermione Granger,We're tied with Slytherin!,hogwarts academics
2285,Hermione Granger,Hope you don't mean yourself!,social dynamics
776,Hermione Granger,I remember reading something in Herbology.,hogwarts academics
2020,Hermione Granger,"They'll catch Black, won't they?",strategy
386,Hermione Granger,We're not supposed to be here... It's forbidden.,hogwarts academics
549,Hermione Granger,That's totally barbaric!,social dynamics
7162,Hermione Granger,Did you see where it went? The diadem!,strategy
2076,Hermione Granger,Don't be silly Ron... broaden your minds.,mentoring
1569,Hermione Granger,Hagrid's our friend. Let's go ask him.,social dynamics
2633,Hermione Granger,"Harry, you can't.",social dynamics
1959,Hermione Granger,Crookshanks ignore the mean little boy.,magical creatures
2606,Hermione Granger,"Sorry Ron, you can't walk...",social dynamics
1450,Hermione Granger,Everything’s set—we just need hair.,strategy
2635,Hermione Granger,Awful things happen to wizards who meddle with time.,mentoring
672,Hermione Granger,"Well that's good, isn't it? He'll be with his own kind.",magical creatures
1202,Hermione Granger,You okay Ron? Say something!,social dynamics
2168,Hermione Granger,It's not funny Ron.,social dynamics
2470,Hermione Granger,Ron. Ron! Ron!,social dynamics
1374,Hermione Granger,No one ever comes in here.,strategy
604,Hermione Granger,And what do you plan to do if this comes up in the final exam?,hogwarts academics
1047,Hermione Granger,What did you do to your glasses? Oculus Reparo.,magic
2876,Hermione Granger,Alastor Moody? The Auror.,strategy
2477,Hermione Granger,Ron! Ron wait! Harry!,strategy
1566,Hermione Granger,It can't be Hagrid. It just can't.,social dynamics
2650,Hermione Granger,Keep trying—come on Buckbeak!,magical creatures
3157,Hermione Granger,Neville's already got someone.,social dynamics
241,Hermione Granger,"It's not real, the ceiling. It's bewitched... I read about it in Hogwarts: A History.",magic
222,Hermione Granger,Has anyone seen a toad? A boy named Neville's lost one.,magical creatures
1242,Hermione Granger,Harry wait! Not so fast!,strategy
2598,Hermione Granger,They're going to suck out his soul!,threats
3227,Hermione Granger,How dare you! I can take care of myself.,social dynamics
2490,Hermione Granger,If you want to kill Harry you'll have to kill us too!,threats
2082,Hermione Granger,I think they're funny.,social dynamics
2502,Hermione Granger,Since Snape set the essay.,hogwarts academics
739,Hermione Granger,"Neville, I'm sorry... Petrificus Totalus.",magic
632,Hermione Granger,The only stone in existence belongs to Flamel... that's what's under the trapdoor!,strategy
533,Hermione Granger,That thing has a name?,magical creatures
2437,Hermione Granger,We'll stay with you Hagrid.,social dynamics
3271,Hermione Granger,We can do this—the three of us.,social dynamics
479,Hermione Granger,But why would anyone go near that dog?,magical creatures
2907,Hermione Granger,Stop it! It's bothering him!,social dynamics
2610,Hermione Granger,Come on. We can't be seen.,strategy
2702,Hermione Granger,I didn't think about that—run!,strategy
2029,Hermione Granger,Harry are you all right?,social dynamics
3220,Hermione Granger,What's got your wand in a knot?,social dynamics
1479,Hermione Granger,I’m not going. You go without me!,social dynamics
1466,Hermione Granger,We'll have one hour before changing back.,magic
1412,Hermione Granger,It's not common... this is bad.,strategy
327,Hermione Granger,Up. Up. Up. Up.,magic
753,Hermione Granger,The harp. It stopped playing.,strategy
395,Hermione Granger,"Standard Book of Spells, Chapter 7.",hogwarts academics
2011,Hermione Granger,Professor R.J. Lupin.,hogwarts academics
602,Hermione Granger,What are the three most crucial ingredients in a Forgetfulness Potion?,magic
2528,Hermione Granger,You attacked a teacher!,hogwarts academics
2856,Hermione Granger,It's hurting again isn't it—your scar.,threats
3233,Hermione Granger,Next time ask me before someone else does.,social dynamics
2627,Hermione Granger,"If we succeed, innocent lives could be spared.",threats
2488,Hermione Granger,Ron you're okay. The dog—where is it?,threats
3491,Hermione Granger,Promise you'll write this summer. Both of you.,social dynamics
2684,Hermione Granger,And Snape's coming.,strategy
2749,Hermione Granger,This came with it.,strategy
2441,Hermione Granger,I think that means you owe someone an apology.,social dynamics
2026,Hermione Granger,Ouch Ron that was my foot.,social dynamics
622,Hermione Granger,I had you looking in the wrong section!,strategy
2562,Hermione Granger,"You go, I'll stay.",strategy
2700,Hermione Granger,Saving your life!,threats
1274,Hermione Granger,"Even in the wizarding world, hearing voices isn't good.",threats
700,Hermione Granger,You mean You-Know-Who is out there right now in the forest?,threats
224,Hermione Granger,"Oh, are you doing magic? Let's see then.",magic
646,Hermione Granger,There are other things defending the Stone... enchantments.,strategy
809,Hermione Granger,"Ron, you don't think this is real wizard's chess?",strategy
2474,Hermione Granger,Do you realize what tree this is?,strategy
545,Hermione Granger,I don't know.,social dynamics
2707,Hermione Granger,"Harry, listen—no one’s coming.",threats
1069,Hermione Granger,Fear of a name increases fear of the thing itself.,mentoring
2709,Hermione Granger,You're dying—both of you!,threats
2640,Hermione Granger,We're coming out the back. Go!,strategy
393,Hermione Granger,"Oh, move over! Alohomora. Get in.",magic
3241,Hermione Granger,Harry you told me you'd figured the egg out weeks ago.,strategy
1045,Hermione Granger,Oh it's so good to see you!,social dynamics
2763,Hermione Granger,Just now. You?,strategy
7052,Hermione Granger,You were thinking. It's Ron's idea. And it's brilliant.,strategy
1456,Hermione Granger,I got this from Millicent’s robes... checking Polyjuice.,magic
3218,Hermione Granger,Hot isn't it? Viktor’s getting drinks.,social dynamics
3267,Hermione Granger,The black lake—that's obvious.,strategy
6979,Hermione Granger,"Did save our lives twice. Kept an eye on us in that mirror. That doesn't seem like someone who's given up, does it?",strategy
705,Hermione Granger,We're forgetting one thing... Dumbledore always feared Voldemort.,threats
652,Hermione Granger,Is that... a dragon?,magical creatures
2113,Hermione Granger,Draco’s father is furious.,social dynamics
2296,Hermione Granger,Look who it is—Madam Rosmerta. Ron fancies her.,social dynamics
6974,Hermione Granger,"That's Ariana, isn't it? Your sister. She's beautiful.",social dynamics
728,Hermione Granger,And with Dumbledore gone...,threats
636,Hermione Granger,We know about the Philosopher's Stone!,strategy
2623,Hermione Granger,That felt good.,social dynamics
2686,Hermione Granger,And now we wait.,strategy
456,Hermione Granger,Swish and flick!,magic
3235,Hermione Granger,Where have you been? Off to bed both of you.,hogwarts academics
2023,Hermione Granger,Why are we stopping?,strategy
2332,Hermione Granger,Ron look! Harry what happened?,strategy
3082,Hermione Granger,Pssst Harry is that you?,strategy
2694,Hermione Granger,Here we come.,strategy
3222,Hermione Granger,International magical cooperation—to make friends.,mentoring
1957,Hermione Granger,"It's a cat, Ronald. It's his nature.",magical creatures
1421,Hermione Granger,He lived a thousand years ago.,strategy
1237,Hermione Granger,Voice? What voice?,strategy
884,Hermione Granger,Feels strange to be going home.,social dynamics
2500,Hermione Granger,He's a werewolf! That's why he's been missing classes.,hogwarts academics
1370,Hermione Granger,Again? It happened before?,strategy
424,Hermione Granger,"Stop, you're going to take someone's eye out. It's Levi-o-sa.",magic
2294,Hermione Granger,Harry isn't going to keep it.,strategy
778,Hermione Granger,Devil's Snare hates sunlight! Lumos Solem!,magic
1280,Hermione Granger,"Professor, tell us about the Chamber?",strategy
2752,Hermione Granger,How fast is it Harry?,magic
1263,Hermione Granger,That's why Ron and I went looking for him.,strategy
