Dialogue ID,Character Name,Dialogue,Topic
6061,Ron Weasley,"The two clinging to the tree are Death Eaters for sure.  Dunno 'bout the bloke on the bench. Can't see us, of course.  But we'll have to be careful coming and going.  C'mon.  There's something else you need to see.",threats
5366,Ron Weasley,"Hello, darling.  Fancy a drink?",social dynamics
735,Ron Weasley,"Trevor shh! Go, you shouldn't be here!",magical creatures
6556,Ron Weasley,I think Hermione's right.  I think we ought to go and see Lovegood. What say we vote on it?  Those in favor...,strategy
1469,Ron Weasley,I think I'm gonna be sick!,social dynamics
4833,Ron Weasley,It's a creepy shop.  He's a creepy bloke.,social dynamics
6239,Ron Weasley,Not bloody likely.  Smells like something Ginny would cook.,social dynamics
810,Ron Weasley,"You there! D-5!  Yes, Hermione, I think this is going to be exactly like wizard's chess!",strategy
516,Ron Weasley,"Come on, Hermione!",strategy
5004,Ron Weasley,"Has a bit of a thing for you, Hermione.  Cormac.",social dynamics
6904,Ron Weasley,You're asking us? You're the brilliant one.,social dynamics
5941,Ron Weasley,"Oh, c'mon!  Beedle's stories are famous!  Babbity Rabbitty? No...?",hogwarts academics
6597,Ron Weasley,Midnight.  Mum always said midnight. But twilight's fine.  Better actually.,social dynamics
6846,Ron Weasley,"Harry, what do we do? Harry...?",strategy
6109,Ron Weasley,Piece of advice.  Let's not rehash old times.  Got it... mate?,social dynamics
1117,Ron Weasley,Ahh-ha-ha! My wand! Look at my wand!,magic
